text,ad
"Live by the Code of the Curve.By right-foot intuition.By a desire for exhilaration around every turn.By the track-bred prowess known as the new Porsche Cayman.With a lighter body,mid-engine dynamics,increased horsepower,re-tuned PDK transmission for lightning-fast shiftingand acceleration from 0 to 60 in 5.4 seconds,you'll never see a curve the same way again.Unlock the Code of the Curve with a test drive.The new Porsche Cayman.Porsche. There Is No Substitute.(script by jamesromick)",1
"Introducing the New Porsche Panamera. The first true sports car that's also a luxury sedan. Elegantly crafted leather seats, a remarkably spacious cabin and a sleek ascending center console provide executive class comfort. But step on the accelerator, and the best in class performance and handling are undeniably present. In short, the Porsche Panamera is the world's most thrilling contradiction. Experience it for yourself, with a test drive. Porsche. There Is No Substitute.",1
"Shake! Roll! Shimmer! No brush! No fuss! New Roller Color loose powder eye shadow. Get that sheer, loose powder look without the spills or fuss. Shimmery color rolls on clean, leaves lids luscious. Ten sexy new shades!",1
"The Toyota Summer Sales Clearance Event is happening now at Roz Kelly Toyota. You've had your eye on that Tundra for too long.Now, own it interest-free.2010 Toyotas are now rolling out with interest-free financing until the end of August on the rugged Toyota Tundra, rated by JDPower as the best mid-size truck and it's being sold by top-rated Roz Kellye Toyota.Hurry, this deal won't last long and there are only a few more Tundras left with no-interest financing. Roz Kellye, your Toyota leader. One half mile pasat the mall on the 210 Interchange.",1
"At SAAB we design cars to perform safely. Not just in testing facilities but in the real world as well. Our real life safety philosophy is what inspired SAAB engineers to create the world's first head restraint system. Designed to reduce the risk of whiplash. It comes as standard equipment on all SAAB models. As do front and side airbags and the Onstar system. At SAAB, safety is not optional. For great deals during the month of June, visit your nearest SAAB dealer.... People who test drive a SAAB usually buy one.",1
"Enjoy the puzzled looks in your rear-view mirror. Especially from BMW and Mercedes owners. The front-wheel-drive Saab 9000 Aero, does zero to 60 in 6.2 seconds, with a top speed of over 150 miles per hour, beating the BMW 530i and the Mercedes E420. Plus, the 9000 was named ""the safest car in Sweden"" three times in a row. Impressive credentials...unless you're too busy scratching your head to notice. For a free Saab Excursion Kit, call 1-800-582-SAAB, Ext. 209.",1
"Sometimes it¹s hard to tell who¹s having the most fun. Introducing the new Saab 95. With available 250 horsepower urging you along the open road and a refined chassis for more precise road holding and cornering the words ""thrilling drive"" are sure to become mere understatement. Add to that our optional Electronic Stability Program for world-class safety and a body that's boldly restyled and you have a car that will, well, give you goosebumps. www.saabusa.com MSRP of $33,995 for a 2014 Saab 95 Linear Sedan. Taxes, insurance, title, registration fees and optional equipment extra.",1
"Visit your tri-state dealer today. Lease a 2001 SAAB 93SE convertible. 36-monthly payments at $499. Total delivery $3,492.62 including security deposit. Title insurance and registration extra.",1
"If you're looking to buy a used car, truck or van, this is the weekend to do it at San Diego Nissan! Friday, Saturday, Sunday and Memorial Day Monday, it's the annual ""Big Top Sale"" at San Diego Nissan!See the huge selection of new and used cars and trucks -- all priced to move! Plus a great inventory of 300 new Nissan models. And zero down delivers -- O.A.C.So come in for a terrific selection of new and used cars and trucks at San Diego Nissan's annual ""Big Top Sale"" Friday, Saturday, Sunday and Memorial Day Monday! Enjoy free hot dogs and soft drinks! Free prizes and souvenirs! Have fun and save cash at the ""Big Top Sale!""Look for the big striped tent and the blimp in the sky! That's where you'll find it all -- at San Diego Nissan! Highway 8 at the Mission Gorge exit!",1
"""He's not stopping,"" was all Wendy Layton's brain had time to scream before the dump truck slammed into the rear of her Saturn. The impact was so forceful it sent, no, hurled her car, which had come to a stop, headlong into the back end of another dump truck, which had also stopped just moments before. Now this might be as good a place as any to point out a few things about a Saturn's steel-reinforced spaceframe and safety cage. For starters, it alone cannot always save your life. But what it can do and did do in this case was absorb the bulk of a pretty powerful impact and dissipate it through front and rear crumple zones, while helping to keep the passenger compartment from being totally crushed. Saturn. Where safety comes first.",1
"Before you buy your next car, Subaru recommends comparing numbers. Like two wheel drive verses four wheel drive. You see, unlike conventional front wheel and rear wheel drive cars, the full time all wheel driving system from Subaru, puts all four wheels to work for you...for superior tracking in snow, sleet, and rain. In fact, we feel the safety benefits of all wheel drive is so important, it comes standard on every car we make. So call your Subaru dealer now.",1
"Earthshaking power. Ground-shedding traction. Be careful where you point it. The all-wheel drive Subaru WRX. When you get it, you get it.",1
The symmetrical all wheel drive system inside every Subaru WXR combines the muscle of a 227 hp turbo charged boxer engine with Subaru all wheel drive for exceptional handling and performance. The road doesn't stand a chance.,1
"Introducing the Subaru year end events--- Where you can get great deals on our entire award winning line up. Like the all new Impreza-with more horse power than Honda Civic or Mazda 3. And now get a special introductory lease of just $199 per month. The all new Impreza, the only car in it's class with the performance of all wheel drive standard. You won't find a better time to buy one than right now at the Subaru Year End Event.",1
"The only thing we didn't improve was the road. The next generation Subaru Outback Limited. We enhanced the 2.5-liter engine for better performance. Redesigned the suspension for a smoother, quieter ride. And even improved our All-Wheel Drive for more traction and control. So what's left to improve? Just what you drive on.",1
"Energize your soul, while cushioning the other parts of your body. Introducing the all-new V6 Grand Vitara. Starting at $17,999. Advanced engineering technologies like a sophisticated 5-link rear suspension and a rugged ladder box frame ensure a smooth and comfortable ride. So if your road to happiness is paved with big rocks, go for it. In the new V6 Grand Vitara, you'll enjoy every bump. Suzuki. Engineered to fit your life.",1
"Turn the key. The 1200 GSX inspired 16-valve engine comes to life. The wind flows around you as you accelerate. You lean into the first turn. The rigid twin-tube diamond steel frame holds the line. And you think, go ahead life, throw me more curves. Suzuki. The ride you've been waiting for.",1
"During the Suzuki Year End Clearance, you'll get the best prices of the year. Start with zero down, zero percent financing for 5 years, and now for a limited time, you'll also get $1,000 customer cash. For the best price all year on the hot new Ariel, the XL7 SUV, and every '14 model. Every Suzuki also comes with America's best warranty for 100,000 miles, making Suzuki America's best value. Take a test drive now before the Suzuki Year End Clearance is over.",1
"(AD FROM GOURMET MAGAZINE) Your brother-in-law is staying another two weeks. 911 puts you on hold. The cable company didn't show up again. That's life. If you want peace and quiet, you just have to find ways to make it happen. Like Avalon. It's Toyota's ultimate way to escape in comfort.",1
"Confine the body and you shrink the spirit. The all- new Avalon. The most spacious, luxurious sedan we've ever created. Toyota. Be good to yourself everyday.",1
"According to the Complete Car Cost Guide -- a nationally recognized authority -- Corolla has been rated excellent for the total cost of ownership. And of all the Corollas sold in the past 15 years, 75% are still on the road. And both Corollas and Corolla wagons have been rated the best overall value. The decision is really easy when you have the right information. Toyota -- simply the best.",1
"For over twenty-five years, Corolla has earned a reputation for consistently delivering on the many promises it's made. Promises to perform day in, day out. Call 1-800-GO-TOYOTA for a brochure and location of your nearest dealer.",1
"At Hampton Toyota...we're having a sale that'll blow you away! It's our annual JULY 4th BIRTHDAY EXTRAVAGANZA...hundreds of cars, trucks, and vans...at unbelievable rock bottom prices. Never before has the Connecticut area seen an event like this. Camrys. Celicas. Corollas...and more...ready for immediate delivery. And it's all happening this Saturday, July 4th, at Hampton Toyota.",1
"It's the 2014 Super Model, Super Deal, Summer Collection from Toyota. Save up to a thousand dollars on the all new Corolla, or lease a Camry for only 199 a month for 36 months. And check out the 4-Runner with its new 2.2 liter engine starting at only 24 thousand bucks. So hurry to your Toyota dealer for the 2014 Super Model, Super Deal, Summer Collection Special. This offer ends June 5th.",1
Life is what you make of it. Why not try luxurious and indulgent? The 2014 Avalon. Toyota . Moving forward,1
The 2014 Camry. Sleek on the outside. Luxurious on the inside. And dependable all-around. Checkmate. Moving forward - Toyota.,1
"Great values certainly aren't always easy to spot. Luckily, the sleek styling of the Toyota Corolla S makes it hard to miss. And easy to love. See for yourself at Toyota.com.",1
Rise up and flee your cubicle. Matrix. It was sent here to free you. Adrenaline-charged performance and up to 53 cubic feet for cargo. The freedom to leave it all behind. The freedom to bring it all with. (Toyota...Moving forward.),1
Rise up and flee your cubicle. Matrix. It was sent here to free you. Adrenaline-charged performance and up to 53 cubic feet for cargo. The freedom to leave it all behind. The freedom to bring it all with. (Toyota...Moving forward.),1
"The Toyota Rav4 has become a very popular family car...and with good reason. It has very good access, great versatility for seating and cargo. Whether it be a 4 or 6 cylinder, you won't be disappointed. They're smooth, peppy, fuel efficient and the standard stability control keeps it secure in emergency maneuvers. Inside the Rav4 there is plenty of head and legroom. The Cabin has a nice wide open feel to it. The controls are positioned up high for easy access and visibility. This particular Rav4 limited edition model comes equipped with a 4x4 automatic transmission, antilock brakes, power steering, power windows and sunroof, fog and puddle lights, keyless entry, cruise control, blue tooth, air conditioning and climate temperature controls. With a JBL 6 disc CD changer and a JBL speaker system, the Toyota RAV4 has all the cozy amenities to help keep your ride a pleasurable one.",1
Saturday afternoon. You've got the whole family at the matinee. Everyone's sunk into their comfy chairs. They begin to unwind as they stare up at the movie screen. That's pretty close to how it feels inside the Sienna. Like a big cozy amphitheater that you can relax in.,1
"Scars are tattoos with better stories. TOYOTA TACOMA. With a 190 horsepower V6 and the highest ground clearance in its class, it's a glutton for punishment. But then, aren't we all? TOYOTA Tacoma.",1
"BIG TOWING. BIG BRAKES. BIG PAYLOAD. BIG AWARD. TOYOTA TUNDRA. 2008 MOTOR TREND TRUCK OF THE YEAR. TOYOTA TUNDRA. When you break into the half-ton truck market, you go big or you go home. Our choice: Go big. That meant giving truckers the capacity they demand from a full-size pickup.",1
"At Hampton Toyota, we're having a sale that will blow you away. It's out annual July 4th birthday extravaganza. Hundreds of cars, truck and vans at unbelievable rock bottom prices. Shop around. Then come to Hampton because we guarantee the lowest prices. The right car, the right price the right dealer. Hampton Toyota, right where it counts.",1
"For more than forty years, the Toyota Land Cruiser has roamed the earth as a dominant species. Each new generation becoming stronger and better adapted to the harsh environments of the world. Today, the 2014 Land Cruiser, with its powerful six-cylinder engine and full time four-wheel drive, is one of the most capable all-terrain vehicles in the world. And yet, with its optional eight passenger interior and nine-speaker CD audio system, it's also evolved into one of the most luxurious. Test drive today's Toyota Land Cruiser.",1
"Sometimes it takes a great idea to give power to good intentions. We think the National Center for Family Literacy is a great idea, and that's why Toyota is proud to be one of its major supporters. Toyota has provided support to more than 150 family literacy programs across America. By supporting NCFL, we hope that the book on missed opportunities will one day be closed forever. To learn more about the great work of NCFL, visit www.famlit.org.www.toyota.com/tomorrow",1
"From a rugged mountain vista to deep in the plush forest, nature calls out for us. And the 2014 Toyota 4-Runner is one of the only machines capable of answering that challenge. With a powerful V6 engine and the highest ground clearance in its class, you'll be able to handle almost anything nature may throw at you. And with 4-Runner's roomy interior, civilization's never really that far away. The 2014 Toyota 4-Runner. Your answer for the call of the wild.",1
"Are you ready for this? Valley View Automotive's got all the hottest SUVs you've been looking for! This week only, enjoy a test drive and the opportunity to drive one of these powerful vehicles off the lot for half the price! Yes, half the price! Now's the time to get yourself to Valley View, by car, on foot, or even by air to take advantage of this outrageous sale - you'd better get here quickly, 'cause this promotion is only going on for 24 hours and the automobiles are leaving the lot faster than you can say 4 wheel drive! Valley View Automotive, SUVs you can depend on.",1
"Are you ready for this? Valley View Automotive's got all of the hottest SUVs you've been looking for! This week only, enjoy a test drive and the opportunity to drive one of these powerful vehicles off the lot for half the price! Yes, half the price! Now's the time to get yourself to Valley View, by car, on foot, or even by air to take advantage of this outrageous sale - you'd better get here quickly, 'cause this promotion is only going on for 24 hours and the automobiles are leaving the lot faster than you can say 4 wheel drive! Valley View Automotive, SUVs you can depend on.",1
"Are you ready for this? Valley View Automotive's got all of the hottest SUVs you've been looking for! This week only, enjoy a test drive and the opportunity to drive one of these powerful vehicles off the lot for half the price! Yes, half the price! Now's the time to get yourself to Valley View, by car, on foot, or even by air to take advantage of this outrageous sale - you'd better get here quickly, 'cause this promotion is only going on for 24 hours and the automobiles are leaving the lot faster than you can say 4 wheel drive! Valley View Automotive, SUVs you can depend on.",1
"Let more outside in. The all-new Volkswagen Beetle Convertible opens up to the world with the push of a button, and the available 200-hp turbocharged engine makes it hard to come back inside. That's the Power of German Engineering.",1
"Look at a Volkswagen. Notice how clean the design is. That look starts small, in the joints between doors and openings. Our designers made these tight gaps a little tighter. So it's more seamless. And nothing makes a designer smile like the word ""seamless."" Volkswagen. Drivers wanted.",1
The new Passat. It only looks like a million bucks.,1
"Introducing the Touareg. The Volkswagen that does what other Volkswagens don't. With a 7,700 lb. towing capacity, a host of luxurious appointments, and a starting price of just under $35,000, it's a vehicle unlike any other. Car and Driver agreed. They named it the Best Luxury SUV in 2014. For more information, go to vw.com.",1
The new Volkswagen Beetle Convertible. One good thing leads to another.,1
Extraordinary in two areas we consider fairly important: stopping and going. The new Volvo S80 T6. Protect the body. Ignite the soul.,1
The new All Wheel Drive VOLVO CROSS COUNTRY. To your body it's a luxury car. To the elements it's an SUV. To your peace of mind it's a VOLVO. The perfect vehical for when you're sailing along a dirt road and suddenly hit a stretch of pavement. VOLVO...adventures in luxury.,1
"Windstar, now with Second Generation airbags, is the only minivan to earn the highest government crash test rating four years in a row - five stars for both driver and passenger. In all, Windstar is engineered with over 40 standard safety features, including anti-lock breaks. And with the Family Entry system's extended drivers door and available tip/slide drivers seat, getting into a truly great minivan has never been easier.",1
"The classic and natural Italian fragrance that combines verbena, lavender and sparkling citrus...",1
"What is that intangible quality that turns heads and touches hearts, catches your eye, and holds you with its power? Every woman has her own special allure. It can be found in a glance, a voice, a face across a crowded room. ALLURE is unmistakable and irresistible. And, like a perfect memory ... it lasts forever.",1
Real men. Real allure. A little mystery adds to the attraction. Allure Homme. The new men's fragrance from CHANEL. At Macy's and Bloomingdale's.,1
"New Almay Bright Eyes. Open wide. Take your eyes from tired to tremendous with the Almay Bright Eyes Collection. Color cream shadows, dual-ended eyeliners and lash-lifting mascara designed to give you wider, brighter, beautiful eyes.",1
"Pop the top! And celebrate beautiful skin. Turn heads and stop traffic with more radiant skin. Aqua Glycolic Toner is specially formulated with an Alpha Hydroxy Acid and pH balanced to tighten skin, even complexion and reduce the size of pores while combating wrinkles. You'll easily see the difference in your skin's natural beauty and with its unique pump dispenser, there's no fuss and no mess. Aqua Glycolic for skin that feels as wonderful as it looks.",1
You can look all around the world.....you can search department stores and boutiques....you can try to see top experts if you've got lots of time and money...or you can fill all your beauty needs online. Beauty.com..... the world of beauty. Online.,1
"Reveal yourself. Your rich, sultry, gorgeous brunette self. Introducing Brilliant Brunette. The first shampoo, conditioner, and styling line just for brunettes.",1
"Illuminate! Shine! Glow! With new Condition finishing shine. Special lightweight ingredients give your hair so much luster, but never leave it looking greasy. Advanced dual protectants leave your hair looking better than ever. There's never been a better way to shine. New CONDITION BY CLAIROL ... because you're worth it.",1
"Hydrience. Incredible color that won't shock your hair. Intense color. Lasting color. Color that loves your hair. It's not impossible. Its Hydrience. Its unique water-based color crème hydrates your hair with pure, permanent color. Nothing penetrates deeper to last longer. Hydrience. Incredible color that's incredibly gentle. By Clairol.",1
"Fall in love! Discover the Clairol Reds Collection. Inspired by romance. Romantic reds are the rage this season, and Clairol reds are loved for being rich, true and made for you. Clairol . . . we make color wonderful.",1
"Work yourself into a lather. Feel what it does for your hair. Ohhh, the organic herbs. Ahhh, the all-natural botanicals drenched in pure mountain water. Ummm, the way it leaves every strand of your hair feeling revitalized. Clairol's Herbal Essences shampoos and conditioners. Oooh, you'll love it. Herbal Essences...a totally organic experience.",1
"For healthy looking color, trust your instincts. Natural Instincts. With 100% pure aloe, chamomile and ginseng. It makes your hair look even shinier and healthier- looking than before you colored it. Clairol. Color wonderful.",1
And your puffs. Your lines. Your under-eye circles. With a little help from Clinique's All About Eyes. Send under-eye baggage a message that's short and extremely sweet: Hit the road. Oh... and don't bother to write.,1
"Make it a happy holiday. A hint of citrus, a wealth of flowers, a mix of emotions. Clinique Happy-a very personal gift.",1
A windswept coastline. Waves crashing against the shore. The endless sweep of horizon. Introducing Coastline our newest fragrance for men. Fresh. Liberating. Distinctive. An invigorating blend of cool aromatics and rich warm woods.,1
"When it's hot, it's the only thing to wear. Cool Water. By Davidoff.",1
"Introducing Cover Girl's New Clean Skin Care. A pure, fresh, innovative moisturizer. Oil-free. Fragrance-free. Water-based. To smooth and silken sensitive skin. It's the moisturizer with a refreshing new difference. Dermatologist tested. From Cover Girl's New Skin Care Collection. Where naturally beautiful skin begins.",1
"Introducing Cover Girl New Nonstop Eyecolor. What makes it last? The extraordinary powder-creme lasting color base, with Vitamin E and Aloe. It goes on first to set the way. So color glides on. Locks on. Stays true. NONSTOP EYECOLOR, new from COVER GIRL.",1
"Labios esculpidos y definidos con reflejos brillantes que te hacen resplandecer.¡Nuevo ShineBlast - 4 veces más brillante!Presentamos el nuevo brillo de labios, ShineBlast. Comprueba cómo la luz se refleja en tus labios provocando increíbles destellos bajo una base de brillo. Además, el nuevo aplicador inspirado por maquilladores profesionales, el ShineSculpt, envuelve las curvas de tus labios. Siéntete resplandecer con ShineBlast.Bella, libre, natural...CoverGirl.",1
"Better skin...in a snap! Aquasmooth Makeup SPR 15. Inside this airtight compact is a fresh form of makeup. Water-based, vitamin-enriched formula. Get noticeably better, beautiful skin every time you use it! In true-to-you shades - easy breezy beautiful COVERGIRL.",1
"""Guess who's not wearing Outlast""? For Lip color that stays on, stays beautiful for 10 hours, Outlast is unsurpassed. The 2-step system means color stays on your lips, and off your glass, even after Pizza! Imitators, you've been outlasted. Outlast all day Lip color, from easy, breezy, beautiful Cover Girl.",1
Wish your moisturizing lipcolor would last? Get the luscious look and feel of moisturizing lipcolor in a formula that lasts a full 8 hours. Covergirl Outlast. In satin and luminescent shades - it's paradise!,1
"Can your lip color outlast this day? What a system! First, the color coat sets in a minute, then the moisture coat shines and helps protect. 34 radiant shades that go from cake to kisses, from Miss to Mrs., without reapplying at all! Outlast All-day lip color!",1
"Our Pixie with her magic wand paints her shiny GlossSticks on. Eyes a-shimmer, lips a-rosy shades of once upon-a-posy. Create your own magic at covergirl.com. Easy Breezy Beautiful Cover Girl.",1
Washable waterproof mascara? Now that's remarkable! New improved remarkable washable waterproof mascara from Cover Girl. Now more smudge proof than ever. Washes off easily with soap and water. And just look at those lashes! Now that's remarkable.,1
"The best tootsies this summer will be twined and wrapped enveloped in sashes, laces and ties of whimsically wonderful shoes. Add the perfect finish with Essie's new summer shades and you'll be colorful from tip to toe. Available at all fine salons.",1
"As you smooth it on, tiny lines seem to disappear. Then you feel the light, silky comfort. And soon you realize that Futurist is more than wonderful makeup. It's refirming, remoisturizing skincare. With a gentle SPF 15, plus Anti-Oxidant Vitamins E and C. To help skin look younger, more vibrant now, and years from now. In shades from soft ivory to mahogany. The future never looked so promising. From Estee Lauder.",1
"Beautiful skin...Young or old. Oily or dry. Every skin can look smoother and more radiant with Fruition Extra. Within an hour, this world-famous multi-hydroxy formula starts working gently to even out skin color and texture, sweep away dry patches, reduce oiliness. And reveal the beautiful skin beneath. Fruition Extra Multi-Action Complex from Estee Lauder.",1
"Say so long to short lashes. Introducing Futurist Lash extending Mascara. Now ""grow"" longer-looking lashes quickly and easily. With the exclusive precision brush and unique lash-extending formula of Futurist, you can sweep on glamorous length and volume to each and every lash-without flaking, clumping or smudging.",1
Here's the fast track to thick lashes. New Magna Scopic Maximum Volume Mascara. Magnify your lashes ­ in a flash. Expandex formula expands lashes up to 300% thicker. Exclusive speed meterbrush hugs each lash with super charged color. It¹s formula one for incredible lashes. Estee Lauder. Defining Beauty.,1
