text,ad
"I rarely do this but;I went to the grocery story with my wife,the other day. She love's that isle with all the different ""Tea's"" in it. I thought what the heck, I'll look around; and I found this one called Throat Coat, (make 'slurping' noise) Mmmm. It's pretty good, has a licorice-y flavor to it.AND I LIKE IT!Conversational read, guy off the street. Surprised he found; something he liked on a shopping trip with his wife!",1
Finally the 'B' is as easy as the 'L' and the 'T'. 0 [zero] to Bacon in 10 seconds. Oscar Mayer. Real Bacon. Real Simple.,1
Pacific Trail. Fitness Collection for Women. Keep the weight of the world where it belongs. Beneath your feet.,1
"With Thanksgiving right around the corner, it's nice to know ShopRite is right around the corner too. You'll find everything you need for all your holiday celebrations at ShopRite. Check out these great savings this week. Center-cut pork chops, just $1.99 a pound. ShopRite ricotta cheese 3-pound container, just $2.99. And Ocean Spray 64-ounce can just 59 cents with clip-less coupon. These prices are in effect Sunday, November 12th through Saturday, November 18th. So shop right and always save.",1
"PAM Extra Virgin Olive Oil delivers superior non-stick performance while adding zero fat to your cooking. It's versatility makes it great for any dish when cooking on your stove top or in the oven. So try something new, or perfect an old favorite. Just get cooking!",1
"Grillers of America? Here's a little secret that'll add more thrill to your grill. Pam for Grilling.It's specially formulated for your grill's high temperatures, so food won't stick and clean-up's a snap. Fire up your grill with Pam for Grilling. Another reason Pam is America's favorite no-stick cooking spray.",1
"Grillers of America? Here's a little secret that'll add more thrill to your grill. Pam for Grilling. It's specially formulated for your grill's high temperatures, so food won't stick and clean up's a snap. Fire up your grill with Pam for Grilling. Another reason Pam is America's favorite no-stick cooking spray.",1
"Do you remember that white bread when you were little -- you know, the one that was so doughy, you could roll it into a ball under the table without Mom ever noticing? And do you remember when the whole wheat craze came along a decade or so later and you could barely break bread, let alone roll it into a ball, under the table or not? Well, PEPPERIDGE FARM has come up with the perfect bread for the 90s: SOFT WHOLE WHEAT.",1
"Remember when you used to sit in your grandma's kitchen when she was baking homemade bread? And remember when she'd take a freshly baked loaf from the oven and top it with your favorite jam? Mmmmm! At Pepperidge Farm, our bread has the same wholesome goodness and flavor as grandma's -- and it's as close as the nearest grocery store. PEPPERIDGE FARM remembers.",1
Keeping an eye on the trans fat in your family's diet? Goldfish crackers have zero grams per serving. The snack that smiles back.,1
PEPPERIDGE FARM RAISIN SWIRL BREAD - with sweet cinnamon and plump juicy raisins. Everything else is - toast. PEPPERIDGE FARM - Never have an ordinary day.,1
"Our whisky barrels live a bold and interesting life. Far away from your air conditioned office, with your iThis and your Facethat.Unlike most whisky barrels, they brave the dramatic swings of the Northern climate, contracting in the harsh winter and swelling in the sultry summer. The whisky working its way in and out of the wood.You could call the process artisanal. But we'd prefer you call it something else...a true original.Feel free to tweet that.Discover Pike Creek Whisky. Crafted by the elements.",1
"I found this offending item in my local supermarket. It's a Philadelphia and Cadbury chocolate mash up. It's a monstrosity. It's cheese and chocolate, chocolate and cheese. Just to prove how not on it is, I had to buy it and try it. Yes, you see, as I predicted that's really...unusual. Mmmm. I mean, choccy Philly, don't be silly. I'll have to finish this now.",1
"Why settle for plain bread?Here's a better idea.Pillsbury Grand Flaky Layers biscuits.In just 15 minutes, the light, delicate layers add a layer of warmth to your next dinner, Pillsbury Grands biscuits,Let the baking begin!",1
Hey. You know the really cool thing about being a grown up? You can order pizza hut pizza...whenever you feel like it.,1
"Out of my love for Planters Nuts and Snacks, I'd like to become Mrs. Peanut. I remember how we met. A party. I saw him by the punch bowl...and immediately ditched the nut I was with. I couldn't keep my hands off him. We did everything together...picnics, carnival rides, synchronized swimming... I dunno, the nut makes me smile.",1
"How do you protect 10,000 year old springs? You depend on the guards that live there. At Poland Springs, that means black bears. We think of them as purity rangers. You see, Poland Spring natural spring water is filtered and purified deep underground. That's why it may be the best tasting water on earth. The guards make sure Poland Spring stays pure and delicious the way nature intended it. Poland Springs. What it means to be from Maine.",1
"Some restaurants have a hard time delivering what you really want. Now I like my steak red and juicy on the inside, dark and crispy on the outside. And the chefs at Ponderosa know how to cook steaks. First, they hand select the finest cuts of tender, aged beef, marinate them overnight in their special sauce, and finally cook them to your order over a hickory fire. That's why people come back for more. Enjoy your steak cooked your way - at Ponderosa Steak House.",1
"Because after 27 years, you're still looking out for him. After all these years, you love him more than ever. That's why you'll only give him Post Premium Bran Flakes. Why premium? Because Post has that special blend of high fiber wheat bran and 100% whole grain wheat. Every big, crispy flake is oven toasted for a delicious taste. After all, he's worth looking out for. POST PREMIUM BRAN FLAKES.",1
"Introducing new Chocolate Caramel PowerBar Protein Plus. Fuel a healthy and active life by adding more protein to your day. Introducing PowerBar's new Protein Plus. It energizes your body with 16 grams of protein, plus 16 essential vitamins and minerals. And enlivens your taste buds with a delicious taste of nuts, caramel and a chocolately coating. Unwrap the power of protein, and take on anything.",1
"Attack the morning with the Strawberry Harvest bar from PowerBar. Energy is the key. And Harvest bars give you that energy, that edge you're looking for. Made with good stuff like whole grains, real strawberries, 7 grams of protein and 16 essential vitamins and minerals. So grab one. And don't just start your morning. Jumpstart it.",1
"You're dedicated. You're out there doing it. The other key: a nutrition program that helps access stored body fat to help you lose weight, perform better, and look more fit. A diet with a 40/30/30 ratio of calories from carbohydrates, proteins and fats can help produce great results. That's what the PR BAR and our 40/30/30 FASTBURN program are all about. Call us and get started on a program that helps get results. 1-800-397-5556. It's all about results.",1
"Paulo has just enjoyed his fabulous meal of Capellini al Pomodoro at Prego, the restaurant. He pays the bill and makes his way toward the bar. Everyone admires him. Or so it seems to Paulo. He is on the prowl. He is a cat, a panther. He is ... Paulo. He waves to the Prego staff and calls them by name. Giancarlo! Giuseppe! Roberto! They do not answer. These are not their names. But Paulo is pleased. He believes he has made am impression on the leggy brunette perched at the end of the bar. She is kittenish, thinks Paulo. But I am the bigger cat. A lion, thinks Paulo. She looks up. What is that she sees? It is the blueness of his eyes? The strength of his chin? No, it is the spinach caught between his teeth. It has been there for hours. Prego. Union Street. San Francisco. See. Be Seen. Be seen eating.",1
"Progresso reinvents chicken soup. Introducing Progresso white chicken soups made with only tender luscious white meat. Only 100% seasoned white meat for an enticing flavor that gives each and every Progresso chicken recipe its own distinctive taste. Mmmm, new Progresso white chicken soups -- unveiling a whole new way to enjoy chicken soup that's totally delicious, totally PROGRESSO.",1
"Nothing is more important than having a good heart. After all, when you feel good, the world around you feels it, too. One way to a healthier heart is a diet low in saturated fat that can help lower the risk of heart disease. Promise Spread is 90% free of saturated fat and has no cholesterol. So promise to get heart smart. It's the most important PROMISE you'll ever make!",1
"We are VERY proud when people tell us Publix save their day, for something we made or something we did, that turn an ordinary day into a wonderful one. It's the same proud feeling we get, when we hand you your receipt, because on every Publix receipt is a total of your savings. See we want to save your day, every time you shop here, by saving you money. We have thousands of items on sale all the time, and buy one get one free deals our customers-love. When you see the signs that say 'save here' you'll do just that, and when you choose trusted Publix's brand products instead of the name brand, You'll save even more WITHOUT sacrificing the quality that you deserve. Along the way you'll find helpful service that you just can't put a price on, because while saving money sometimes means making a few small changes, changing where you shop doesn't have to be one of them.LOVE TO SHOP HERE - LOVE TO SAVE HERESee how you can save this week at Publix.com/save.Publix - where shopping is a pleasure.",1
I ate Quaker Oats for 30 days - Took my cholesterol down 13 points. QUAKER OATS warms your heart and soul.,1
"Ever feel like temptation is following you? Now would be a good time for Quaker Mini Delights. Mmmm. (crunch sound) Now he makes me melt. (giggle) Quaker Mini Delights. Rich, chocolately, multi-grain cakes in a 90-calorie pack. Every day should be this good.",1
"Oat. Meal. With all of a bowl of instant oatmeal, see why these Quaker Oatmeal Breakfast Squares are so filling. It'll be something to smile about.",1
"Bite into the scrumptious blend of chocolate chips, nuts, and raisins in new Trail Mix. Or the harvest of real apples, cranberries, and mixed berry flavors in new Apple Berry. Either way, they're both made with the goodness of whole grain oats, wheat, and rice. And never more than 130 calories a bar. Two great new granola tastes. One wholesome snack. New, Quaker Chewy Granola Bars.",1
"Always baked never fried so they won't weigh you down. Quaker Oats rice snacks, potato stix and corn rings. Look for them in the rice cake isle and hold on to your taste buds.",1
"Its time to pick favorites at Red Lobster; choose freshly breaded shrimp, juicy shrimp scampi, or one of our bold new tastes. Mix and match any two dozen for 9.99. Two dozen shrimp just 9.99, now at Red Lobster.",1
"There are times of the day when you might wish regular, rich Sara Lee could be a little bit lighter ... but just as delicious. So we made Sara Lee Light Coffee Rings ... coffee rings so fluffy, they seem to disappear. SARA LEE LIGHT COFFEE RINGS ... Blueberry, Raspberry, Maple Crunch, Almond. All sweetness and light. Even the price is light.",1
"If you've been lucky, scanning labels has been the way to find low fat and low calorie products for the new healthier way you're eating. But after the eating begins, your taste buds may not feel quite so lucky. Well, quit scanning and start eating, because Lean Cuisine from Stouffer's is always low fat, always under 300 calories, and always delicious. So scan no more! STOUFFER'S LEAN CUISINE varieties keep your scanning time, and your figure, to the bare minimum.",1
"""Sunchips lovers believe that 'wholeness' is the road to happiness.""""They believe in embracing themselves, quirks et al."" (maybe do an alternate -""quirks and all"")""Sunchips lovers believe in moderation not deprivation""""They are self directed and do not follow trends.""""Instead they dance to their own tunes""""They would rather chase rich experiences than riches""""They find joy in the small pleasures of life""""And believe in making healthy choices that will benefit the whole family.""""Why do consumers love sun chips?""""SunChips is authentic and real""""SunChips is about loving life..."""".. And not needing it to be perfect.""""SunChips is about effortless and accessible fun.""""It is about being quirky without being childish.""""SunChips gives consumers the feeling they are doing good for themselves.""""Besides what the brand stands for, consumers also love what the product brings.""""Sunchips is like a sensory treat and engages all the senses.""""One of the key brand differentiators is MULTIGRAIN symbolizing that SunChips is made of whole, real ingredients.""""The unique wave shape of the chips represents flow and balance.""""The crunch is hearty and crispy and then swifty falls apart.""""The crunch is hearty and crispy and then swifty falls apart.""""Sunchips enjoys tremendous brand love!""",1
"Noises? Well with a family of five, I'm quite used to them. Like the time Billy hurt his pinky. (sfx: painful shriek.) Oooooh that hurt. And like the time Sarah's first boyfriend broke up...right before the school dance. (sfx: whiny cry.) Oh, that doesn't sound good. But what does sound good is (sfx: entire family ""yumming"") Swanson Family Style Meals. And with under seven-minute prep time, they sound good to me too. Swanson Family Style Meals. They sound good,  'cause they are.",1
"People who serve Le Menu tend to see frozen dinners in a different light. You won't find too many frozen dinners that can hold a candle to Le Menu. Le Menu is a whole line of premium dinners. Each gives you three perfectly orchestrated dishes. Like Pepper Steak -- tender slices of sirloin beef garnished with green peppers, alongside long grain rice and crisp oriental vegetables. Try Le Menu just once, and we're sure you'll see the light. LE MENU ... from SWANSON!",1
"For well over a century, the adventurous flavor of Tabasco brand Pepper Sauce has fired up generations of thrill seekers. Try it on your favorite foods for a burst of flavor that's sure to tantalize your taste buds. Tabasco brand Pepper Sauce.",1
All of the other flavors secretly refer to it as the Italian stallion. Tabasco Garlic Pepper Sauce. Tabasco.com.,1
One cup of hot milk. One teaspoon of Taster's Choice. One wonderful cup of Cafe au Lait. It's as easy as 1-2-3. Taster's Choice brings you the smoothest Cafe au Lait this side of the Eiffel Tower. Visit our website for a free sample. That's www.tasterschoice.com You'll feel like you've just been to Paris.,1
"That moment when you have your first bite of Tasty Bite and you realize...You just had healthy, delicious Indian and Asian food in just 60 seconds... in your dorm room.It's a whole new meal plan.Tasty Bite. One bite will change everything.",1
"What kind of tea makes iced tea that can stand up to ice? A tea with so much flavor it won't melt with the ice. A tea that's made with tiny little tea leaves for big tea taste. Tetley Tea. It has a color so deep, a flavor so big, it stands up to ice. Tetley starts out strong, so it lasts long. No matter how long you linger over iced TETLEY, the flavor comes through the ice.",1
"Our jerky punches gas station jerky in the face. Seriously, this is the best beef jerky you can find. Man up and take it for a spin! The Blue Ox Beef Jerky Company. Real Men Eat Jerky.",1
"Now you can warm a muffin in your toaster. Because Thomas' has baked banana-nut, raisin bran, blueberry, corn, and chocolate chip muffins into toaster-size shapes. New delicious TOAST-R-CAKES muffins, from the makers of THOMAS' English muffins. Quick, warm, wonderful.",1
"So this guy I was dating seemed to have it all. Good looks, a great job, a nice smile, and oh...his laugh-so funny! But the truth of the matter is...that smile that started the laugh...ended with bad breath! It seemed the one thing he didn't have was a Tic-Tac. And I was so close to happiness!",1
"Enjoy great TOSTITOS brand taste with the benefits of all natural ingredients! With Natural Tostitos Tortilla chips, we're bringing big flavor to smart snacking. Made with organic corn, these tortilla chips feature the authentic TOSTITOS brand taste you love. And with no preservatives, no hydrogenated oils and nothing artificial, you get 100% TOSTITOS brand taste naturally.",1
"Sure it's a snack food.But a lot less snack, and a lot more food.Real. Satisfying. Crackers.Triscuit.",1
The blend is exhilarating. Like a welcoming burst of cool sensations. It's delicious. Tropicana Blends 100 % juice.,1
"Have you had your protein today? To help keep you and your family going strong all day long, try Tyson Beef Tips in Gravy. It's protein you can really sink your teeth into. Pre-seasoned, slow-cooked, and ready in five-minutes. Look for Tyson Beef Tips in Gravy in your grocers' meat section. And for power-packed recipes, visit Tyson.com.",1
"Unbelieva burgers are back! Bacon cheddar, chili-cheese, or mushroom swiss...just 2 for 3 bucks! Can't beat um gotta eat um. Unbelieva burgers just 2 for 3 bucks at Checkers.",1
"Don't laugh, but I started using Uncle Ben's after I was in this taste test. They had a whole lot of us comparing Uncle Ben's and the other leading national brand...my rice. What a difference! Uncle Ben's looked better, tasted better, wasn't sticky, Turns out Uncle Ben's beat my old rice something like two to one.",1
"Once again, health and nutrition are cool. How cool depends on the temperature of your refrigerator. Drink a V8 and you¹ll get something that will never go out of style: a full serving of vegetables. With antioxidant vitamins A & C, potassium, and lycopene, V8 is once again proud to be part of the latest health craze.",1
"A diet drink that's nutritious, too? How refreshing. Who says diet drinks have to be all style and no substance? Diet V8 splash not only tastes great, but gives you a full day's supply of Vitamins A and C, and lots of Vitamin E in each 10-calorie serving. Think of it as beauty, with the brains to match.",1
"Okay, so you're doing the daily grind. You know ... car pooling with 5 people in a 4-person car ... when all of a sudden, you smell coffee breath that would kill Juan Valdez. So, you reach deep into your pocket. Sure enough ... you have an extra Velemint. So, you look directly at Bob and say, ""Would anyone else like a Velemint?"" VELEMINTS ... good breath ... good day.",1
"You're just three minutes from heaven with new Warm Delights Minis from Betty Crocker. Just seconds in the microwave and you have in hand the most decadent, delicious, warm desert 150 calories can buy. New Warm Delight Minis - mini size, maximum delight.",1
"take 1: ""You can lead a horse to Wetzels, but you can't take him inside. Company policy.""take 2: ""Remember how great it felt when Mom put your artwork on the fridge? That's how it feels to eat our pretzels. Like... artwork on a fridge... mmmmmmm.""",1
"Tired of waking up sluggish ""CRUSH IT"" with Wheat Crushers multi grain the new complete breakfast bar for on the go. Say good-by to sluggish and Hello to a Great Day. Wheat Crushers the morning fuel.",1
Too good to put down. Tastes good. Feels good. Wheat Thins.,1
"You haven't loved a salad, until you've spritzed it. Introducing Wishbone Salad Spritzers - delicious vinaigrettes - you spray! Just the way you like, any way you like.",1
"Everyone loves Yoo-Hoo. Even moms love it 'cause it has lots of vitamins and minerals and it's 99% fat-free with no cholesterol. And you'll really love our new set of cool baseball cards with a lineup of Hall-of-Famers and All-Stars. To get your free set of 10 limited edition Baseball Legends cards, check Yoo-Hoo packages in your favorite store for details. YOO-HOO. The cool way to do chocolate.",1
"Salad as a meal can be simple and fresh. The need for healthy, fresh lunches and fast, easy suppers have turned pasta into the new centerpiece. Aside from being quick, cheap and easy to find, pasta also comes in lots of shapes for those who need variety. Pasta salad's other key ingredient: fresh vegetables, kept that way with the help of ZIPLOCK brand SLIDE-LOC bags.",1
"Aetna/US HealthcareNo matter where we live--when it comes to something as important as health care--we all want the best. That's why AETNA and US HEALTHCARE have joined forces to create a partnership that will set a new standard for quality and caring. AETNA and US HEALTHCARE. Raising a standard for your town, for your family, and for you.",1
"There is a tremendous amount of thought and care that go into hospitas each and every ay. The wonderful, proud moments. The life-saving treatments. Even the miraculous.It's just a way of life for over 5 million people that work in America's hospitals every day.It makes you wonder sometimes though. With all this amazing stuff going on in hospitals, an awful lot must be going on in their heads. If only we could take a sneak peak to what they're really thinking.",1
"He makes you laugh.Actually likes snuggling.And never channel surfs.Doesn't he deserve a little extra attention from you?Each year, dogs of all ages, breeds, and sizes develop arthritis.So pay close attention to yours.If you notice a loss of mobility or energy level after normal activity, find out how Rimadyl has helped nearly one million dogs with arthritis put quality of life ahead of their pain.",1
"Arden Courts specializes in caring for people in the early to middle stages of Alzheimer's. Every detail is designed to make life simpler and more fulfilling for residents -- from the secure layout, to the meaningful activities, to the staff trained in the latest caregiving techniques. Arden Courts is part of ManorCare Health Services, the company that pioneered Alzheimer's care, with a 35-year reputation of helping seniors and their families. We have the expertise and experience to simplify and enhance your loved one's life. And to help you find the peace of mind you deserve.",1
"For a physician, their passion lies with helping others, not dealing with a mountain of medical paperwork. That's why Athena Health is here to help. Athena Health is the leading provider of cloud based business and clinical services, including Electronic Health Record Software, patient engagement, and many more. For an award-winning company dedicated to serving your hospital or medical group, you can find care in Athena health.",1
"When he said I had cancer, I couldn't believe he was talking to me. But then he said it was good I came in when I did, and that there were very effective treatments now . . . and from that moment on, Banner Hospital was at my side helping me fight this disease every step of the way. My cancer is in remission now and even though they can't give me any promises, the people at Banner Hospital gave me something even more valuable. They gave me hope.",1
"At Berkeley Eye Care - Houston, it's that special time of year when more patients decided to have Lasik than any other time of year. For many people, having new vision is just the perfect way to start off the new year. For others, it's the chance to make a resolution that they can finally keep and enjoy every day of their lives. And for some people, having Lasik now is a chance to use those tax-free flex dollars at work and see Houston in a whole new light.Whatever your reason, make 2013 the year you say 'yes' to Lasik at Berkeley Eye Center - Houston. With free patient financing, low monthly payments and our 2013 Lasik savings, having Lasik now is more affordable than ever. Call Berkeley Eye Center of Houston today at (281) 363-3443 and say 'yes' to Lasik. That's (281) 363-3443 or visit us online at berkeleyeye.com. (pronounce as berkeley eye dot com)Specifics: Radio spot, ran 1:00 with approx 1 second of music lead in and about 2 seconds lead out.Contributed by TxTom",1
"What is innovation? It's a solution. An idea. It's the discovery of achieving great things. Innovation is ambition. A dream. A dream that says anything is possible. It's been said that no human undertaking was ever achieved without it's first basic element - that's belief. Belief at it's core has always been the first foundation to ideas. And if those ideas are strong enough to form into greatness. They have the power to soar beyond the heights of our imagination. And can turn good things into amazing things. That have the power to change,to improve,to make everything in our lives.Better You See Innovation isn't about today.It's about tomorrow.Innovation has never been about what 'is'. It's always been about what 'can be'. And if you are willing to believe,you've already gotten the hard part out of the way. All you have to do is take the first step. And make it happen. This is the journey to better.",1
"Bio-Identical Hormone Replacement Therapy won't turn back the clock, but it will help you age more gracefully.Your doctor can do more than prescribe a few pills. As you begin to face the symptoms of aging, ask your doctor to refer you to a compounding pharmacist.A compounding pharmacist can fine tune your prescription drug therapy to your individual needs. Your local compounding pharmacist is ready to serve you.",1
"Are you exposing yourself? If your security software depends on a list of known viruses, you're more exposed than you think. Bitdefender's lightning quick security solutions provide the most advanced 2 layer security- protecting you from known and unknown threats. Download a free trial to see what threats are lurking on your system. BitDefender the future of security now.",1
