text,ad
"Not long ago in a Chili's restaurant, the server, carrying a big mouth burger to a customer turned a corner and collided with another server carrying a tray of nachos. Both customers got more than they expected, because what could have been disastrous turned out delicious. Tangy tortilla strips, jalepenos, and pesto on a burger grilled to perfection. Introducing Chili's new NACHO BIG MOUTH BURGER. Nachos and burger...on a collision course with destiny.",1
Why are these kids laughing? Why not? Fun and joy of learning are essential to growing up and we're proud to play our part at Chuck'E'Cheese's by supporting children's public television where a kid can be a kid.,1
"Your neighborhood steak house featuring cuts of award winning Tri-Tip. New to San Marcos since 2012, Luke's will soon be your favorite bar and grill. Hearty meals of sandwiches made with fresh bread and sliced Tri-Tip with barbecue sauce, or barbecue chicken ½ or sandwich. For a taste treat try their signature chicken tacos, or a Shrimp Louie salad with sliced egg, avocado and cucumbers in garden fresh lettuces and homemade 1000 island dressing. Personally the Sourdough Garlic dinner rolls are delicious, I could eat a basketful.They serve a large selection of craft beers and your favorite cocktails. Make a point soon to visit Cool Hand Luke's Wild West Grill your neighborhood joint, it's a winner.",1
"HERE AT CRACKER BARREL OLD COUNTRY STORES, IT'S ALWAYS BEEN ABOUT PLEASIN PEOPLE.WE'RE KNOWN FOR DOIN STUFF.....DIFFERENT LIKE.EVERY CRACKER BARREL STORE OFFERS HOMESTYLE COOKIN....MADE FROM SCRATCH...RIGHT HERE IN OUR OWN KITCHENS.YOU'LL FIND SOME EXCITIN NEW ITEMS AND PLENTY OF THE OLD FAVORITES I JUST KNOW YOU'RE GONNA LOVE....AND THEY'RE ALL MADE WITH THE QUALITY INGREDIENTS YOU'D BE EXPECTIN FROM CRACKER BARREL.AN DONTCHA FORGET BOUT OUR RETAIL STORE, WHERE YOU'RE GONNA FIND LOTSA NICE GIFTS N STUFF...PLENTY OF WARM ""HOWDYS""...AN SOME DURN GOOD BUYS TOO,SO STOP IN TO A CRACKER BARREL OLD COUNTRY STORE NEAR YOU FOR SOME GOOD SHOPPIN AN A GREAT MEAL.I GARUNTEE YA....YA AIN'T LEAVIN HUNGRY!",1
"Only from Domino's, new pesto crust pizza. Sweet basil, parsley and garlic, baked right into the dough. Then sprinkled with romano cheese all around the crust. Call and get a large, one topping, just 9.99. Get the door...it's Dominos.",1
"Introducing Dunkin Donuts all new freshly baked muffins. They're incredibly delicious, and bigger than ever before. You'll love them for a long, long time. Of course, nothing lasts forever. Bigger muffins, bigger taste new from Dunkin Donuts. Stop in today and try Dunkin Donuts' new bigger muffins with a cup of delicious coffee.",1
"Discover a latte that's delicious, indulgent and a lot more convenient. Dunkin Donuts' incredible new latte. It's rich. It's creamy and it's so much easier.",1
"Dave's Baby Backs are back at Famous Daves!Try Dave's original Baby Backs, Seasoned, smoked for hours, then slathered in Dave's very own honey sweet BBQ Sauce. Or try Dave's Memphis style Baby Backs. dry rubbed with herbs then flame kissed to lock in the flavor. Hurry in to Famous Dave's! Dave's Babies are back, but only for a limited time.",1
"Ferrara. America's first espresso bar since 1892, in the heart of Little Italy. Open daily, 8.00am to midnight. Serving continental coffees, pastries and desserts, assorted gelati and after-dinner drinks. 195 Grand Street, NY City call 212-226-6115.",1
"Looking to reel in some really tasty fresh fish?Look no further than FireFish.And at just $10.95 each...you'll fall hook, line, and sinker for all 8 of our Locals' Specials.Add some fire to your next dining experience at the FireFish Grill on the Santa Cruz Wharf.",1
"When we asked families about their restaurant experiences, everyone complained about hassles with food. Your four-year-old wants ""pasgetti"" like Mommy makes. Your eleven-year-old demands pizza, pizza, pizza. Your teenager scarfs down fast-food burgers and fries. While you prefer something a little more on the elegant side. What families need is variety where they eat. That's where Friendly's comes in. Friendly's... America's favorite family restaurant.",1
"Right now at Furr's, Enjoy all the fresh shrimp you crave in different tasty flavors you'll love, like coconut shrimp, golden-fried butterflied shrimp, or buffalo shrimp, every day after 4 p.m. Not sure which will be your favorite? Well, you don't need a favorite. That's like picking a favorite lotto to win. They're all awesome. So try every type of shrimp. Twice even. Because all of Furr's flavorful shrimp, and other entrees and sides, are all-you-can-eat for one low price. Choose your favorite shrimp or choose them all, right now, only at Furr's.",1
Kentucky fried chicken asked a leading authority to taste our honey barbecue wings. Tender juicy wings in a savory barbecue sauce with a touch of honey. Honey barbecue wings from KFC. The experts are buzzing about it.,1
"When dining formally, in order to avoid an embarrassing utensil faux pas, observe the following protocol: Begin by locating your seafood fork. Grasping this fork between thumb and forefinger, proceed to shove it into the ear of the person directly to your left. Next, to impress business associates, stick your soup spoon up your nose and exclaim, ""Look at me, I'm a bowl of soup."" When the entree arrives, use the butter spreader to catapult particularly juicy portions onto the balding heads of nearby diners. And finally, quietly finish with your dessert utensils, all the while, of course, making odd gurgling noises and clucking like a chicken. This lesson in table etiquette has been brought to you by Linguini and Bob, who invite you to enjoy serious Italian food in a not-so-serious atmosphere. Linguini and Bob, now open at Butler Square in Minneapolis.",1
"When it comes to eating out, there's a nice little place in town. You might even miss it, 'cause it's not one of those flashy glass and neon places. It's, well, it's different. Serves real meals at prices that are hard to believe these days. LONG JOHN SILVER'S. Come on in.",1
"Cool Hand Luke's Wild West GrillYour neighborhood steak house, featuring succulent cuts, of award winning Tri-Tip beef. New to San Marcos since 2012, Luke's will soon be your favorite bar and grill. Hearty sandwiches made with fresh bread and sliced Tri-Tip, topped with our secret barbecue sauce, or maybe some barbecued chicken? For a real taste treat... try their signature grilled chicken tacos, or a Shrimp Louie salad, with sliced egg, avocado and cucumbers in garden fresh lettuce with homemade thousand island dressing.Personally the Sourdough Garlic dinner rolls are so delicious, I could eat a basketful.They serve a large selection of craft beers as well as your favorite cocktails. So make a point to visit cool hand luke's, your neighborhood steak joint, it's a winner.",1
Me. Myself. My salad. Okay. This is it. This is the salad for me. The Grilled Chicken Caesar at McDonald's. I am so into all the different kinds of lettuce and the cute little tomatoes. But what really shouts my name is all that warm grilled chicken. I drizzle on the low fat Newman's Own all natural Balsamic Vinaigrette and I am one happy woman. Want to hear me go on and on about the crispy cobb or bacon ranch salad too? I'm lovin' it.,1
Me. Myself. My salad. Okay. This is it. This is the salad for me. The Grilled Chicken Caesar at McDonald's. I am so into all the different kinds of lettuce and the cute little tomatoes. But what really shouts my name is all that warm grilled chicken. I drizzle on the low fat Newman's Own all natural Balsamic Vinaigrette and I am one happy woman. Want to hear me go on and on about the crispy cobb or bacon ranch salad too? I'm lovin' it.,1
When I open my sandwich I like knowing what's inside is for real. Nothing but 100% marinated chicken breast in every Chicken McGrill. Want to know more? Visit www.mcdonalds.com. McDonalds. I'm lovin' it.,1
"How to get no kick from Champagne. Meier's All-Natural sparkling juices contain no alcohol and no added sugar. Choose from nine crisp, bubbly flavors, and give any occasion a natural sparkle. MEIER'S. For a natural life.",1
"Turn your passion into a profession with a career in restaurant management. At the New York Restaurant School, we'll give you the theory as well as the practical, hands-on training managers need to succeed in the thriving food service industry. From kitchen operation to front-of-the-house. Flexible class schedules are available five days a week. To get started, call the New York Restaurant School now at 1-800-556-8215. That's 1-800-556-8215.",1
"Oceana has long been known in foodie circles as ""the place"" for the finest seafood and freshest fish in New Your City. Fresher fish, you'll only find in the ocean. With our Michelin-Star cuisine, world-class wine cellar, exceptional service and spectacular setting, Oceana takes the seafood experience to a whole new level. Oceana is conveniently located right in the heart of Manhattan, at 120 West 49th Street between 6th and 7th Avenues, just steps away from the Theater District, Radio City and Rockefeller Center. For reservations, call 212-759-5941. And visit us on the web at OceanaRestaurant.com.",1
"Try The Olive Garden's Mediterranean garlic shrimp, only $9.95 for a short time. Enjoy shrimp now sautéed in a new roasted garlic sauce of herbs and spices -- with free salad, soup, and bread sticks, during the Italian seafood festival at THE OLIVE GARDEN.",1
"Everyone agrees that preventing illness is a lot easier than curing it. And one of the easiest ways to reduce some health risks is to drink 100% Pure Florida Orange Juice. It's loaded with Vitamin C -- an anti-oxidant that may reduce the risk of some types of cancer. So remember, when it comes to health care, an ounce of prevention is worth a pound of cure -- and 8 ounces of ORANGE JUICE is very valuable indeed.",1
"The taste of time. Seven years for the vines to mature. Four weeks for the buds to flower. Six months for the grapes to ripen. Paul Masson proudly presents its exquisite California Red. The finest and roundest of reds, with a silky texture ... a distinctive bouquet. PAUL MASSON will sell no wine before its time.",1
America wants more. So Planter's is giving you more. New Planter's Nuts N' More. Delicious fruit. Chocolate chips. Sesame sticks. America...you wanted it?...you got it. New fresh-roasted PLANTER'S NUTS N' MORE. More than you ever dreamed of ... and more.,1
"Introducing the great taste of French toast-in a Pop Tart. New French Toast Pop Tarts, part of a complete breakfast.",1
"It starts with an idea.Tell all your friends.Plan a trip.Don't forget the hot sauce.Get on your way.Cruise the open road.Find a small motel in the middle of rural America.Guard that hot sauce.Wake up in the morning.Discover your saddlebags are missing.Your cash, credit cards and keys are gone.Take advantage of the free continental breakfast.Enjoy the best scrambled eggs you've ever had in your life.All because of the hot sauce.Porcus Infernum. The World's Best Bacon Hot Sauce, Bar None!",1
"Got a cravin' for Cajun? New Orleans style fried chicken, cajun battered fries, and buttermilk biscuits. Love that chicken at Popeye's.",1
"Carlo and Maria have come to Prego, the restaurant, for their fabulous food. But they are too in love to notice the food. They have been in love for a very long time now. For over an hour, which is a record for the both of them. Maria plucks a mezzelune from her plate and feeds it to Carlo. He is a little plaything, she thinks, like a puppy -- loyal, eager, panting ... drooling. She takes a bite of his Agnello Grigliato. The people at Prego stare, but Carlo and Maria, they care not. They are blinded with love. It is a game of cat and mouse. Of kiss and tell. Of ... crime and punishment. Carlo glances at her. Ah! She is perfect. But what's that? A crumb is stuck to her chin! Maria has noticed something herself. A sucking sound. Could that be Carlo eating? Oh, Carlo! Oh, Maria! Their disillusionment is as thick as the minestrone.",1
"Eat Soup, Feel Good. A traditional stock and chunky-chopped ingredients cooked in small batches in an old-fashioned kettle. Pret soups are freshly made (never frozen), with absolutely no stabilizers, additives, preservatives or colors....What's not to love?",1
"Dave's Baby Backs are back at Famous Daves!Try Dave's original Baby Backs, Seasoned, smoked for hours, then slathered in Dave's very own honey sweet BBQ Sauce. Or try Dave's Memphis style Baby Backs. dry rubbed with herbs then flame kissed to lock in the flavor. Hurry in to Famous Dave's! Dave's Babies are back, but only for a limited time.",1
"Here at Runza, many people ask us why we don't serve breakfast. Our answer is simple, because we're busy making lunch. We're up with the roosters each morning to start hand slicing onion rings and making Runza sandwiches. And we wouldn't have time for that if we had to spend our mornings figuring out how to inject syrup into bread. Seriously, people actually do that, but not us, because we don't do everything. We do our thing. Runza, the difference is real.",1
"Rocco's Famous PizzaWill this be pick-up or delivery?Pick-up? Great.May I please have your name and your phone number? Thank you.Okay, your total will be $10.15 and your order will be ready in 15 minutes.Bye-bye.",1
"And now a brief lesson in ""Moo-ology""MooThat means the Sirloin Stockade has great food.Mooo.That means the prices are affordable.Moooo.He says they serve more than just steaks and burgers.Moooooo.He recommends you try...the chicken.Sirloin Stockade. 790 North Main Street in Canton.",1
"When Starbucks creamer meets your morning coffee, your favorite Starbucks flavors come to life. Smooth, bold, creamy. Inspired by the Starbucks Caramel Macchiato you love. Mornings just got better. This changes everything. New Starbucks creamer. Now at home.",1
Starbucks Double-Shot espresso drink is a delicious blend of espresso and cream to help you take on your day.,1
Starbucks Frappucino coffee drink is a delicious blend of coffee and milk to smooth out your afternoon.,1
"Of course Stella Artois tastes better than other beers. We've had over 600 years to get the recipe right. Since 1366 Stella Artois has been painstakingly brewed in a time honored tradition - using the choicest ingredients. Which is why our customers have kept coming back for more, even after 600 years. Stella Artois. Perfection has it's price.",1
"{00;00.2} We've all got things to do{00;01.1} And it seems like lines pop up everywhere{00;02.3} If you don't have time for the line, you can Avoid the Line At Sweet Peppers Deli{00;06.8} Call in your Order{00;09.4} Download our app{00;12.3} Or Order online at Sweet Peppers Deli dot com",1
"""Deja food. The eerie feeling your having the same food at every group event. Because... you are. But now, there's a cure.Whatever your occasion, mix things up with twelve delicious tacos in one box. Taco Bell party packs, party food will never be the same.""",1
"Texas Tom's Fire Pithas the best Bar-B-Que in Town.Yee HawIf you're lookin' for the best ribsyou ever had, don't look any further than Texas Tom's",1
"What's new for lunch at Tim Horton's? Our sandwiches.New 'Tim's Own' homestyle sandwiches are made with a freshly baked country bun - that's new. And we've added tomato - that's new too. We even have our own creamy new dressing.It all adds up to a whole new sandwich. From Black Forest Ham and Swiss to Garden Vegetable. There are six new varieties to choose from, made fresh and fast for you.New 'Tim's Own' sandwiches. The homestyle sandwich that's making a lot of news.",1
"Tim Horton Donuts have baked up another fresh idea.Introducing strawberry timtarts: a flaky tart shell brimming with rich, smooth custard nestled with fresh glazed strawberries.Come and discover Tim Horton's newest pastry treat everyone will love: strawberry timtarts. It's just one of the tasty timtarts you can try at our place and take home for dessert.Tim Horton Donuts. Fresh. From your friend along the way.",1
What's so special about Wendy's new Bacon Swiss Burger? Bacon. Special Sauce. Swiss cheese. More bacon. All on a toasted kaiser bun. It's the only bacon swiss burger with three strips of bacon! Mmmm. Doesn't that sound delicious? WENDY'S NEW BACON SWISS BURGER. Come on in now and grab one while they're hot!,1
"Don't just eat chicken, eat better chicken. Wendy's new delicious Chicken Temptations Sandwiches. They'll have you excited about chicken again.",1
"Introducing Wendy's Home-Style Chicken Strips. Baked tender pieces of juicy home baked fillets, with your choice of three delicious sauces. When it comes to chicken strips we have a better way. Wendy's its better here.",1
"You can't put a price on quality. But if you could, it'd be 99 cents. Trying to save money and eat well? Wendy's has a better way.",1
"Where's the beef? Not in a freezer. The secret to Wendy's hamburgers really isn't a secret. We simply refuse to use frozen beef. Only fresh beef. Every hamburger ... every time. No freezing, no way, no how; So every bite is tasty and juicy, no matter what you order. Because it's made Dave's way, fresh ... never frozen.",1
"So it's 2:00 in the morning...and you're starving. Nothin' in the fridge, and nothin' in the cupboards. You don't even have dog biscuits hangin' around. You think about cooking, but then you remember the 3-alarm fire you started last time you tried using the stove. Well, check out 7-11. There's gotta be one right near ya'. They have everything from burgers to tacos...24 hours a day...7 days a week. 7-11. Think of it as your own personal walk-in kitchen.",1
A Diamond is foreverDesign the perfect diamond engagement ring in just minutes. You'll have the rest of your life to design the perfect husband. Visit a diamond is forever.com,1
"You know, Ace Brand lawn and garden supplies are made with a satisfaction guarantee.Because all the talk in the world doesn't matter if you can't back it up.Ace Brand",1
Total control. Total performance. Introducing Adidas Anti-Perspirants and Deodorants. Adidas...when life is rough.,1
"To celebrate 15 years of successful cooperation, Alitalia is pleased to offer its passengers the prestigious scarves of the Salvatore Ferragamo collection at an exclusive price. Alitalia and Salvatore Ferragamo...15 years on board together.",1
"At Apple, we design our computers specifically for the needs of education. We design them to be powerful enough to prepare high school students for the technology they'll encounter in the future. Yet we also design them to be easy enough for a first grader to use. We design our computers to run all of the Macintosh programs schools are already using; and we design them to run a whole new family of enhanced software that makes graphics, video and animation even more life-like and exciting.",1
It's 2am and you can't sleep. Ideas for tomorrow's meeting are running through your head. Have you made a mistake on your tax calculations? You reach for your iPhone and the bright light dazzles you. Your partner stirs. Quick turn on Dark mode. Dark mode coming to iOS 13.,1
"When I wear Bali, I feel beautiful, and when I feel beautiful, I am. Experience the new Bali ""Passion-For-Comfort"" bra, with it's silky-smooth lining and simple elegance. You'll find beauty in everyday comfort. Live beautifully, in Bali bras and panties.",1
"A sensual revolution. A bra that's there, but barely. Smooth, soft, unencumbered comfort. Discover it. Nothing feels better. Barely there.",1
Bed Bath and Beyond now has 20% off any one of their hundreds of thousands of items. Check your mail for the coupon. Or visit www dot bed bath and beyond dot com to sign up for exclusive email offers and promotions. Bed Bath and Beyond. Beyond any store of it's kind.,1
"If you need to escape the daily grind, come to BEST BUY. You'll find tons of games and you can play all you want. Which beats working through lunch. BEST BUY. Turn on the fun.",1
"I liked your read. But, the music, to my ear, a touch too loud. https://www.bigvalueshop.com",1
"Join the club! BJ's Wholesale Club is looking for friendly andenergetic individuals to join our team! We have full-time, part-time and seasonal opportunities across our chain.Find a club near you and apply today!",1
"Like you, we can't get enough of the outdoors. It's in our blood. It's in our work. It's in our nature®. So, when you buy Cabelas branded gear, you're buying tradition. You're buying exceptional expertise and a better product. It's gear that's built to help you get more outdoors for your money. Gear so well made, it's backed up with our legendary lifetime guarantee. Look for the green badge. It represents the best value and quality anywhere. Cabelas - for a lifetime.",1
"Lace so soft and delicate, you simply forget it's there. It may be a detail, but it's a Chantelle.",1
"Thanks for calling Corner Music, Nashville's pro music shop for over 40 years-now in our new location at 3048 Dickerson Pike-just 6 miles north of downtown Nashville.Our store hours are 10-6, Monday thru Friday, and 10 til 5 on Saturday.You can also check us out on the web at CornerMusic.com. - or send us an email at: info@cornermusic.com. That's info at Corner Music-dot-com.............................Whether you visit our store or shop online, we think you'll be impressed with our huge selection of guitars, basses, keyboards and drums, from top brands including Fender, Gibson, Gretsch, Roland, Korg, Yamaha and many others.And as Nashville's only Gibson 5-Star Acoustic dealer, we have over 50 Gibson acoustic models, along with guitars from Breedlove, Larrivée, Eastman, and more - plus new mandolins, banjos, resonator guitars and accessories for the bluegrass and acoustic player.We also offer a great selection of guitar and bass amplifiers, to suit any style of music and any size venue - from arenas to listening rooms and recording studios. And you'll find hundreds of pedals and effects to create just about any tone...........................Corner Music's keyboard department is loaded with digital pianos, organs and synthesizers-as well as MIDI controllers and drum machines. You'll find a great selection of recording gear, microphones, stands, cables and everything else you need for your recording setup or P.A.Our Audio/Visual specialists can even design and install entire multimedia systems-including sound, lighting and video presentation-like we have for over a thousand churches, schools and businesses across the country. We have the experience and knowledge to create the best solution for your space and budget................................Corner also offers an in-store pro repair shop, to keep your guitar or bass at its best. Stay on the line to book an appointment, or drop by to talk to one of our repair specialists. And if your amp or keyboard needs attention, we can help with that, too.If you're just starting to play-or if you'd like to play better-Corner Music offers lessons for guitar, bass, banjo, mandolin and keyboards. Ask us for information, or click on the ""LESSONS"" tab at CornerMusic.com.Thanks for holding. Someone will be with you in less time than it takes to play the intro from ""Stairway to Heaven.""And, by the way ... we kinda wish you wouldn't.",1
"Someone just paid too much for a luxury watch.Why pay more for a pre-owned luxury watch than it's worth? With our experienced Swiss-certified watchmakers and comprehensive value database, you get an authentic, performance tested watch at a price that won't make you feel like you paid too much. Don't be a goat.",1
"There's an old saying. Nothing succeeds like success. And we're proving it again at Montauk Highway and Great East Neck Road. You see ... that's where we're opening Long Island's twenty-eighth Edwards. Now just what accounts for our success? You do! You've supported us from the very beginning. You like the fact that we don't make you carry a special shopper's card, or clip coupons to save money. And you're glad we don't set limits on what you can buy. Instead, we just have low prices on everything in the store every day. All 350 varieties of produce. All our fresh sea food. All our USDA choice gold star beef and lamb. Everything from the bakery, pharmacy, flower shop, the food court, the dry cleaners, even one hour photo processing, plus we feature thousands of bonus buys every week. And discounts on all free price merchandise. In short, we make it easy to save. Come to Edwards' grand opening, Sunday, May 4th, at Montauk Highway and Great East Neck road in West Babylon. And ... have a little shopping success of your own.",1
"Yesterday, my daughter said she'd die if she didn't get these new shoes everyone's wearing. Well, if it wasn't for Fayva, we'd have lost a daughter. See, at Fayva, I can afford to keep up with the latest craze, because they don't go crazy with the prices. Now she says she can't live without a new pair of jeans. Oh well -- we'll miss her. FAYVA SHOE STORE -- You could pay more, but why?",1
"Kountry Cabinets & Home Furnishing's ""Made in America Sale""Our three-day only sale brings you solid-wood, heirloom-quality furniture, all made in the good ole USA! Thisdining table and 6-chair collection, only seventeen, ninety-nine! This 4-piece bedroom collection, only twenty-nine, ninety-nine! Believe it or not, this dining table and 4-chair collection, only seventeen, eighty-nine! This awesome 4-piece collection for only thirty-seven, ninety-two! October 5th, , 6th, and 7th! Very limited quantities! Doorsopen each morning at ten o'clock to celebrate America atKountry Cabinets & Home Furnishings",1
