text,ad
"Women make up seventy percent of the labor force in Uganda, yet rarely get the chance to bring their own products to market. 23 Women is a real story of real women who saw the need to join together, work hard, and deliver the best coffee their country could offer.Rated the number one coffee in Uganda at the AFCA Taste of Harvest Competition, these women produce some of the best coffee in the world.",1
"It's right in your own backyard.While it may be hard to believe, roughly five million Americans don't even know where their next meal will come from.In communities just like yours, there are many who need help.Join people across the country who are coming together with AARP Create the Good, to end hunger.Start today. It can be as easy as giving food or money to your local area food bank, or getting tips to start your own food drive.Whatever level of involvement is right for you, we've made it simple to find and help people in your area.So get involved. Go to www.createthegood.org/hunger.",1
"I thought I respected myself. That is, until I saw myself get high. It's just an ugly side of myself that I didn't recognize. Saying and doing things that just weren't me. I do respect myself, that's why I don't do drugs.",1
"If there's a place in your heart for a wild mustang or burro...and you're ready to adopt... come to Ingalls Park in Norco this Saturday and Sunday.The Bureau of Land Management will offer 80 wild horses and 20 wild burros to qualified adopters through its Adopt-A-Horse or Burro Program.These beautiful mustangs and burros were gathered from public lands in California, and they're in excellent health. They arrive at the park around noon on Friday and will be available for public viewing.Mustangs are renowned for their strength, speed and endurance. Burros make excellent pets, companion animals and guard animals.The minimum bid is only $125 dollars per animal. Fees may be paid by cash, check, or credit card.Don't miss this opportunity to adopt a wild mustang or burro this weekend at Ingalls Park in Norco.For more information call eight hundred, nine five one, eight seven two zero. That's eight hundred, nine five one, eight seven two zero.",1
"When someone abducts a child, they're not about to advertise it. But we will. Sign up at wireless Amber alert.org to get free Amber Alert text messages on your cell phone. Wireless amber alerts. A child is calling for help.",1
"The American Academy of Neurology has issued a new guideline to help determine when people with Alzheimer's disease or dementia should stop driving. The guideline advises caregivers to watch for warning signs including: crashes, traffic tickets, avoiding driving at night or in rain and an impulsive personality. To learn more or to find a neurologist near you, visit the American Academy of Neurology's website for patients and caregivers at AAN.com. (pronounce the letters separately.) That's AAN.com.Direction note: 30s PSA. Pronounce the letters of the website (A.A.N.) separately.U/L by TxTom",1
"Join the American Bar Association to stay current on legal developments, earn CLE credit, and enjoy exclusive savings. The ABA offers expertise on a national scope, career and practice advice, networking opportunities with legal professionals from across the U.S., and much more. As a lawyer licensed to practice in the one of the states, territories, or possessions of the United States, you will soon find the ABA has become an essential component of your professional life.",1
"American Cancer SocietyAmerican Cancer SocietyIt's tough to quit smoking. Just ask any of the 50 million Americans who continue to puff away, even though they know the toll it takes on health and longevity. When it comes to breaking this lethal habit, the most effective tool is willpower. The American Cancer Society now offers a free video for those smokers who feel they can't quit alone. Call the AMERICAN CANCER SOCIETY today, at 1-800-575-2424.",1
"Ask one of the 3 million Americans who've survived cancer, if the money spent on research is worth it. Please help.",1
"Do you know what these items have in common? They can kill people who are severly allergic to them. Things as simple as peanuts, milk, eggs and shellfish can cause a severe allergic reaction called anaphylaxis. As many as 1 out of 7 people may at risk for anaphylaxis. Other causes include insect stings, antibiotics, and latex. Are you, or someone you love at risk? Be prepared. Completely avoiding an allergen is impossible. There are treatments that reverse the symptoms of a severe allergic reaction. If you or someone in your family has had any of these symptoms after contact with items like these, talk to your doctor.",1
"For a kid with asthma, the joys of childhood quickly become living nightmares. A playful kitten, a cuddly puppy, a bouquet of flowers, all are potential triggers for terrifying attacks. Don't let Asthma rob another childhood. Call 1800 Lung, USA. The American Lung Association.",1
"Every 67 minutes someone dies from melanoma. With early detection, most of these deaths can be prevented. This May, through the power of friendship, Olay and the American Society for Dermatologic Surgery invite you to save some lives. Ask your best girlfriend to join you for a free skin cancer screening, and encourage her to always wear an SPF. For more information go to skincancertakesfriends.org. Don't let beauty become a beast. Protect, detect, and love the skin you're in.",1
"There's just not enough Art in our Schools. No wonder people think Louis Armstrong was the first man to walk on the moon. It's a long way from the Apollo Theatre to the Apollo program, but for Louis Armstrong giant leaps for mankind were simply a matter of course. For more information about the benefits of arts education, please visit us on the AmericansForTheArts.org. Just like great Louis Armstrong, all you need is a little brass. Art. Ask For More.",1
"At 4:00 my kid will be at (leave a beat of silence here). If you can't fill in the blank, you need to start asking your kid questions. It's a proven way to steer kids clear of drugs. It's not pestering. It's parenting. This message sponsored by the Anti-Drug Campaign",1
"It's not half as uncomfortable as talking to your kids about sex. But just as important. Talking to your kids about marijuana can clear up a lot of the questions they might have. And the ones you might have, too. Talking about marijuana can also make your kids feel more at ease in dealing with it when they have to, which is probably more often than you think. Besides, after everything else you've talked to them about, it's not as uncomfortable as you might expect. For more information and a fact-filled booklet, call 1-800-788-2800.",1
"At 4:00 my kid will be at _________________________. If you can't fill in the blank, you need to start asking. It's a proven way to steer kids clear of drugs. It's not pestering. It's parenting. ASK: WHO? WHAT? WHEN? WHERE? QUESTIONS. THE ANTI-DRUG.",1
Talking to your friends about their problems with drugs and alcohol might not be easy. But it can make all the difference. Courage. The anti-drug.,1
"Kids need to talk about not smoking with someone they can trust. YOU. The ""Take 10"" challenge invites you to take a written pledge to discuss with your children why they shouldn't smoke. Once you sign, we'll also send you the tools you'll need to get your conversation started.",1
"Passing gas around infants. Can be deadly. Passing gas releases a toxic fog of ammonia and hydrogen cyanide, which can be especially harmful on an infant's developing lungs. Passing gas can even contribute to sudden infant death syndrome. Kids shouldn't be exposed to second hand smoke. Don't pass gas - take it outside.",1
"In Appalachia, there are still little children like Amy who go to bed hungry at night - little children who are deprived of the basic necessities, right here in America. For just $24 a month, you can sponsor a child in desperate need. You can provide food, warm clothes, health and school needs - and maybe even a toy or two.",1
"The Armed Forces of the United States are not separate and independent parts of the government; rather, they compose one of the instruments of national policy. Since the birth of the Nation, policies and directives have been made by civilians assigned to the military and to the executive and legislative branches of the government.",1
"There's something you can do -- right now -- that will ease the pain of arthritis in years to come. By remembering The Arthritis Foundation in your will, you can help us find ways to stop this serious, often crippling disease. A disease that affects one in every seven Americans. Call THE ARTHRITIS FOUNDATION, at 1-800-552-HAND. It's time we took arthritis seriously.",1
"Asian Affair Holidays are designed for the independent traveler, for those who desire more than the ordinary vacation. So treat yourself to one of our flexible travel values, such as Hong Kong for 5 nights from $1088, and Singapore, Bali, and Bangkok -- 9 nights from $1929. We have included round-trip airfare, choice of hotels, sightseeing and private car transfers to and from airports. Let the enchantment be your reality. Call your travel agent for details, or order our beautiful video for just $12.95. Call 800-997-8886.",1
"For a kid with asthma, the joys of childhood quickly become living nightmares. A playful kitten, a cuddly puppy, a bouquet of flowers, all are potential triggers for terrifying attacks. Don't let Asthma rob another childhood. Call 1800 Lung, USA. The American Lung Association.",1
"In five minutes or less. To help Zimbabwe's teens resist the lure of so-called sugar daddies-men who buy clothes for the girls and pay their school fees in exchange for sex-an American named Nancy Padian started SHAZ(Shaping the Health of Adolescents in Zimbabwe). Your $10 gift, made through Women's Global Health Imperative (wghi.org) provides job training for girls; $25 covers a semester's school fees.",1
"If you're in two minds, leave early.The best way to prepare for this fire season, is to stay informed and plan to leave early before you see smoke or fire.Talk to everyone you live with, so you all know when you're going to leave and when you're going to go, if a fire starts.Pack a relocation kit with important documents and essential items.On high risk days, check fire danger ratings, and fire warnings on the CFA website and listen to local radio.Don't wait and hope for the best. Visit the CFA website to find out how you can be Fire Ready.Visit CFA.vic.gov.au or call 1-800-250-6675. Prepare, Act, Survive.",1
"All of a sudden, a $2,000 grill seems perfectly reasonable. Beef, its what's for dinner.",1
"What's more romantic than cuddling old dogs, cooing over kittens, walking potbellied pigs, cleaning bunny pens and shoveling horse manure? Just ask Takiko May and John Ewing. Instead of sipping mai-tais in Maui, they spent their honeymoon as volunteers doing just that at Best Friends Animal Sanctuary in Kanab, Utah.______________________script by jamesromick",1
"When experiencing depression, I couldn't get out of bed or focus. My goals anddreams drifted away. I got my life back through the help of a support group ofpeople who had been where I was. They helped me see that my life wasn't limited- that I could still achieve my dreams.Fifty thousand people find compassion and encouragement at their localDepression and Bipolar Support Alliance support group. Visit support helps dotorg, or call 800-826-3632 to learn more. We've been there. We can help.",1
"One of the most important activities to share with your baby is reading. That's why The Brown County Public Library is offering the ""Born To Read"" program for teen parents. Tutors provide coaching, a video offers tips, and librarians distribute books and other materials. The program is made possible through a grant from The Federal Institute of Museum and Library Services. For more information or to be a volunteer call, 505-555-1234.",1
"Put this card in the hands of a child and there'll be no room for a gun. A needle. Or a knife. It's only a piece of paper, but that little membership card has helped keep millions of kids off drugs, out of gangs and in school. To learn how you can help the Boys & Girls Clubs, call 1-800-854-Club. Boys & Girls Clubs of America. The POSITIVE Place For Kids.",1
"Remember your best friend from childhood? Remember swearing you'd be best friends forever. Well she just found a lump in her breast. One out of every eight women will develop breast cancer in her lifetime. With your help, we will change that statistic. So join the fight. If not for yourself, for someone you love.",1
"In the U.S. alone, over 200,000 women and 1,300 men will be diagnosed with breast cancer this year - 40,000 will die. Let's not rest until we win the battle against breast cancer. With your help, we can erase this disease - for good. The Breast Cancer Research Foundation.",1
"Breast Cancer doesn't just affect women. Consider the families and friends whose lives are also changed. In the U.S. alone 215,990 women and 1,450 men will be diagnosed with breast cancer this year and over 40,000 will die. We cannot rest until we win the battle against breast cancer. At the Breast Cancer Research Foundation a minimum of 85 cents of every dollar donated goes directly to cancer research and awareness programs. The Foundation has a 4 star rating, the highest possible, from Charity Navigator, and an ""A"" from the American Institute of Philanthropy. For more information, go to our website at www.bcrfcure.org or call toll free 866 Find-A-Cure. With your help we can erase this disease for good. The Breast Cancer Research Foundation. Prevention and a Cure in our lifetime.",1
"Imagine your body being buried while you're still in it. Imagine the horror.You'd struggle. But struggling only makes it worse.Imagine your whole life reduced to thinking about your next breath.Eventually, you'd welcome death... but an emphysema sufferer can go on living like this for years.If you smoke, death could be the least of your worries. Stop, before the suffering starts.",1
(Sound of motor revving up)If you hear this sound (seat belt warning ping) it means you forgot to fasten your seatbelt.(Horns honking and screeching tires)This sound means it's too late.Give safety a hand. Everyone buckle up.(Total 15 second PSA)Contributed by TxTom,1
"You have the power to do something right now that could drastically affect the rest of your life. It doesn't involve decisions about college, or work, or joinng the military or anything like that. It simply involves using a condom if you're having sex. See, the risk of getting HIV and AIDS is still out there and these days, half the people who get HIV are 24 years old or younger. You can trust the person you're with, you can love the person you're with, but trust and love can't stop HIV - condoms can. The person you're with may look fine, but they could be infected. And having unprotected sex just once can turn your whole life upside down. Every 15 minutes of every day another person 24 or younger gets infected with HIV. Make sure you're not one of them. Respect yourself, protect yourself. Have questions, call 1.800.922.AIDS. Brought to you by the California AIDS Prevention Campaign.",1
"A life time of smoking was odds that she just couldn't beat.Doctors said she could maybe live 9 months with Chemo...6 months without.She chose the latter. She was 58 and I miss her a lot.I do not know if Cancer can be beat but I do know that smoking can.So...if not for yourself, then do it for someone else...do it for my friend Jackie!",1
"A cancer diagnosis changes everything. It turns someone¹s world upside down- emotionally, physically, and even financially. Cancer Care can help. Please call us at 1-800-813-HOPE. When someone understands, it makes all the difference in your world.",1
"Today, my friends are throwing me a party. They do it every year on this date. it's not my birthday, but it is the fifth anniversary of the day I was told my cancer was in remission. And it's a day I thought I would never see.",1
You know it's going to be a bad day when you wake up looking like the picture - on your driver's license. When you accidentally stumble upon your dog's morning surprise. When you...somehow...get toothpaste in your eye. (ouch!). When your boss takes you aside...and leaves you there. But hey - this could still be your lucky day. Play cash five from the Pennsylvania lottery. Cash five has at least a 100-thousand dollar jackpot.,1
A national TV and radio campaign for the Donate A Phone program seeks to collect as many of the country's inactive cell phones as possible. The phones help domestic violence victims to get a hold of emergency assistance quickly.,1
"Every day in the United States, 3 children die as a result of maltreatment in the home, and child abuse is reported, on average, every 10 seconds. This year, approximately 3 million cases of child abuse will be reported. However, most experts believe the actual number of instances is three times that number. However, there are anonymous and confidential places to turn to for information about reporting suspected abuse. Americans should trust their instincts and act on behalf of a child, because organizations such as Childhelp USA can offer the support and information necessary to help transform a child's life.",1
"If your child's cough is getting in the way of their day, try Children's Delsym. Delsym is the number one pediatrician recommended cough medicine that helps control coughs for up to twelve hours. The formula even comes available in grape and orange flavors. For great tasting relief, try Children's Delsym.",1
"The open enrollment period for your health insurance plan comes once every year, usually during the fall. With so many insurers and employers raising health insurance premiums and scaling back benefits, you need to know how your health plan stacks.",1
"As a parent, I know what city kids face in the streets today is bad enough. And now, Mayor Guiliani wants to slash school building improvements and after-school youth programs...all of which are essential to keeping youngsters off the streets. Don't let this happen to our children's futures. Call the Mayor and your council representative. Tell them you want to put kids first, not last, when they plan the city budget. A message from CITIZENS' COMMITTEE FOR CHILDREN.",1
"Smear campaigns...mud slinging...twisting the truth.Why do politicians resort to such underhanded tactics?Do they think it really helps their campaign?It's ugly, uncalled for, and deceitful.So why do we allow them to continue?It's time to level the playing field.You want our vote? Then focus on the issues that affect all of us.This election season, advocate for a clean election process.Paid for by the committee for cleaner elections.",1
"She did what no human soldier could, and my team returned home alive. She gave so much. Doesn't she deserve a good home, too? Won't you give what you can now?",1
"For the 27 million Americans who can't read, competing in today's marketplace is nearly impossible. And unfortunately, the future for children of illiterate parents is not much brighter. You can help fight illiteracy by reading to a child. And by giving a child a book. Brought to you by THE COORS FOUNDATION FOR FAMILY LITERACY. Because a child who reads will succeed.",1
"#1 CureSearchCureSearch for Children's Cancer is a 501(c)3 U.S.-based non-profit foundation thataccelerates the search for cures for children's cancer by driving innovation, overcomingresearch barriers and solving the field's most challenging problems. We fight every dayto make new, better treatments possible for the 43 children diagnosed with cancer eachday.",1
"Today, in the United States, over 134,000 children wait in foster care for adoptive families. Many are siblings that need to stay together, others are older or may have special needs. Yet they all have something in common: a desire to be part of a permanent, loving family. If you've ever considered adopting please call 1-800-ASK-DTFA, Dave Thomas Foundation For Adoption.",1
"She doesn't talk about her bruises. She doesn't talk about her depression. She doesn't talk about her missing days at work. So how do you tell her you've noticed? If your friend is a victim of domestic abuse, talk to her about it and don't stop talking until the violence stops. To find out how, call 1-800-VIOLENCE for a free brochure.",1
"#1: My older brother had everything going for him. I always looked up to him. He just had a way with people. But last Saturday night, Tom left us ... forever. And all because of a drink he should never have had. You see, in high school, the other kids think it's cool to drink and drive. We know better. DON'T DRINK AND DRIVE. It changes everything.",1
"Ya know, I never thought John would get to this point. It used to be just a couple of drinks at a party, maybe an occasional drink after work, but he would never drive drunk, or so I thought. If I had only stopped him before he got into his car, maybe John would be here today. Friends don't let friends drive drunk.",1
"A drinking and driving conviction could cost you more than 20,000 dollars. You could lose you license, your friends, or your life. Fairfax Community council on impaired driving and the government of Fairfax want you to arrive alive. Drive sober.",1
"Drug abuse may not be an epidemic, but it is a major public health problem. The impact on American society is staggering. Each year, drug abuse kills 14,000 Americans and costs taxpayers nearly $70 billion in unnecessary health care costs, extra law enforcement, auto accidents, crime and lost productivity. Illicit drug abuse hurts families, businesses, and neighborhoods, impedes education, and chokes the criminal justice, health and social service systems. While overall use of drugs in the United States has fallen by half in the last 15 years, adolescent drug use continues at high levels. Teach your children to stay off drugs.",1
"As a parent, you want to so everything you can to keep your kids from experimenting with drugs like pot. It would be a whole lot easier if they came with instructions. But they don't. We can help. Play with them. Read to them. Sing with them. Teach them a joke. Laugh. Listen. Talk. Be involved. Call 1-800-788-2800. We'll send you information on what else parents can do. Also visit drugfreeamerica.org You can make a difference.",1
"You notice your friend has been throwing away her lunch. She's started wearing baggy clothes - all the time. She seems tired. These are warnings of an eating disorder, the deadliest mental illness we know. But early treatment is the key to recovery. And as a friend you can be the difference.",1
"A little reminder from the Environmental Defense Fund that if you're not recycling, you're throwing away a lot more than just your trash. You and your community can recycle. So for a free brochure, please call the Environmental Defense Fund at 1-800-EDF-1234.",1
"Thanks to you, all sorts of everyday products are being made from materials you've recycled. But to keep recycling working to help the environment, you need to buy those products. So look for products made from recycled materials, and buy them. It would mean the world to all of us. For a free brochure, please call 1-800-CALL-EPA.",1
"Out of all the planets in our solar system, there is but one element which sets Earth apart ... and sustains the framework of life. Our atmosphere. Within this delicate balance lie the secrets of our wildlife ... our forests ... our streams ... and our future. In over 100 million households across America, the Energy Star program allows every American to play a vital role in reducing air pollution. You can help fight air pollution by calling the EPA at 1-800-POLLUTE.",1
"Now key nutrition facts from the back of the package can also be found right up front on America's favorite brands. Making it easier for busy shoppers to make informed decisions.By knowing your daily limits for calories, sodium and fat, you can choose the foods-and the amounts-that are right for you.Go to FactsUpFront.org to find the nutrition targets for everyone in your family. Along with shopping tips, recipe ideas and more.",1
"As a dad, you'll probably spend years teaching your son how to hit a baseball. But the question is this: How much time will you spend teaching him what not to hit? Teach your son early and often that all violence against women is wrong. For tips on what to say visit www.endabuse.org.",1
"According to a recent survey, 86 percent of dads spend more time with their children today thantheir own fathers did with them. However, 7 out of 10 also reported that they could use tips onhow to be a better parent. The smallest moments can have the biggest impact on a child's life.Take time to be a dad today. For more information call 877-4DAD-411or visit fatherhood.gov.",1
"With your help we've been able to collectively impact our world and make a difference in the lives of those in need; from our local communities to nations around the globe. Providing meals to the hungry, supplying relief to those effected by natural disasters, and giving back to people right here in our own backyard. Together we can continue to make a difference in our world for generations to come.",1
